title,stars,text
Pancuran Beach,5,ruhiger strand mit musik toiletten verpflegung und palmenschaukelkein eintritt
Pancuran Beach,5,gemtlicher ruhiger strand nettes warung mit freundlichem wirt angenehm um bei shake kenapa muda oder bier das meer zu beobachten sehr gutes preisleistungsverhltnis strand wird gereinigt
Pancuran Beach,5,most karimun visitor choose the famous bobby or karina in the north but i prefer this beach the first freeentry beach on southeast side of karimun jawa island the entrance is like going downhill until the parking space and then walking downstairs to the beach area there is only one restaurant with quite good playlist if you are lucky you can connect to their wifi i think their highlight menu is fried pineapplei visited this beach twice for lunch and sunrise view since it was weekday there was less people its like having the beach for yourself when its getting crowded then the time to leaveit is a swimmingsnorklingkayakingpaddling spot so you can enjoy those activities here you can find another hidden beach in the north just next to the corner there is a path between the rocktoilet is available next to the restaurant
Pancuran Beach,4,nice spot for photo
Pancuran Beach,4,pantai yg cocok untuk melihat sunrise dengan htm gratis
Pancuran Beach,5,bagus banget sunrise nya
Pancuran Beach,5,sepi kayak pantai pribadi
Pancuran Beach,2,la playa est muy sucia llena de plsticos y botellas y el agua sucia tambines una pena que no cuiden las playas
Pancuran Beach,5,pantainya emang bagus untuk sunrise tp untuk kebersihannya kurang udara disini masih sejuk
Pancuran Beach,4,the coastline is shorter compare to other beaches that i came on the island but have a nice sunrise view since we came too early at eid moment the bar not open yet btw the entrance fee is free
Pancuran Beach,4,akses jalan menuju pantai sudah cor betonmudah di aksestapi sayang kendaraan tidak bisa turun pantaipantainya bersih ombaknya tenang nyaman buat bermain bersama anak2the best hidangan di kafe ini pisang gorengnya beda dengan yg lain
Pancuran Beach,5,best one
Pancuran Beach,5,air lautnya bening bangetpasirnya bersih ada spot foto lumayan banyak dari ayunan pohon kursi kayu dengan view laut dan gunungdi bagian kursi kayu itu viewnya cakep banget sayangnya butuh ekstra hatihati buat nyampe ke bagian kursi kayu akses jembatan kayunya udah lapuk banyak paku mencuat dan lewat batu karang
Pancuran Beach,5,tempat nyaman untuk kontemlasi udara segar pantai bersih pokoknya joss dah
Pantai cemara besar,5,bagus bgt pantai yg aman bgt buat anak2
Pantai cemara besar,5,small place small island but it has a beautiful scenery but there are just 2 toilets only
Pantai cemara besar,5,pantai cemara besar salah satu spot yang paling keren buat yg hobi foto foto karena disini banyak banget spot yang bikin aura kita jadi lebih gantengtempatnya juga bersih paling pas buat istirahat untuk mengisi perut yang mulai keroncongan sehabis snorkeling next bakalan kesini lagi pokonya
Pantai cemara besar,5,istimewasurga nya karimunjawa
Pantai cemara besar,5,bangga indonesia mohon dirawat dengan baik supaya tetap lestari
Pantai cemara besar,5,pulau kecil tempatnya indah dan istimewa
Pantai cemara besar,5,bibir pantai nya panjangdan putih
Pantai cemara besar,5,tempat yg cocok buat makan siang
Pantai cemara besar,5,nice spot for sunrice fresh air and good view wonderful place
Pantai cemara besar,5,rata rata untuk lokasi di karimun jawa bagusbagus
Pantai cemara besar,5,pantai di pulau kecil berada di wilayah perairan karimunjawa pantai dengan air laut yang jernih dan sangat indah
Sunset Beach,5,cakep
Sunset Beach,5,bagus banget best time kesini jam 36 sore magical banget sunsetnya
Sunset Beach,4,pasirnya halusbanyak kedai makananbisa main permainan air seperti banana boat kayaking jetski
Sunset Beach,5,biarkan foto berbicaracantik sekali sunsetnyabyar masuk 20rbsayangnya kita harus order di t4 kita dudukbanyak pondokan yg jual makananwajib belanja klo dudukkelapa utuh 25rboke harganya masih wajarview nya cakep bangetdisini jg banyak yg nyediain kano banana boat dllklo menurut sy sunset beach ini cakep utk sunsetpas posisinyausahakan datang pas cuaca cerahklo mendung sunsetnya gak kliatanparkiran klo di karimun jawa gratis senang sekali warga jabodetabek disinimakanannya jg tergolong enakgak manis
Sunset Beach,5,lumayan bwt nyunset ada watersport jg
Sunset Beach,5,pantainya sangat bersihhtm 10k
Sunset Beach,2,some parts of the beach are full of plastic and random shacks that totally ruined the charm of this beautiful place it mustve been a paradise before people took it over but i get that for many its a way to make a living so i dont blame them and i must understand their reality still it looks pretty sad the nature itself is beautifu and a color of the water is magical the amount of trash is also kind of shocking i wish the indonesian government would do something to protect this amazing place because it is special nature is your real treasure
Sunset Beach,5,pantai ter konekting dengan ujung gelamlumayan sepi dibanding ujung gelammemang bagus untuk menikmati sunsetworthrekomenmasuk melalui pantai ujung gelam bayar 10rb per orang
Sunset Beach,5,hidden gem di karimun jawa musik lite dance and beaches tersedia jg lite bite food kelapa hijau n beers sesuai dgn namanya dapat menikmatin sunset dari sini disarankan menggunakan motor kemari kalo mobil perlu gardan depan karena balik nya tanjakan curam
Sunset Beach,5,this place is wonderful as well as to get a sunset such as its name it has a nice atmosphere and always has a comfort feelings around but as usual indonesian are still lacking at how do they maintenance things such trash luckily the trash at the sand beach was less noticeable sustaining useful facilities and awareness about many of stagnant water that causes mosquitoesthe best way to enjoy those chilling atmosphere those splash of ocean water and bird chirping is when the beach is not that crowded my fams are lucky that we arrived at the right time and date910
Sunset Beach,5,you can rent a mat here and enjoying the view its comfy and quiet before 3pm a lot of snack and softdrink here good place to visit no ticket fee
Pancuran Beach,5,pulau karimun jawa
Pancuran Beach,3,saat aku kesini jalannya sedang di perbaiki namun pantainya tidak terlalu bersih mungkin karna dalam perbaikan pantai nya kecil
Pancuran Beach,4,i visited this place by walking from near the dock of karimun island its pretty far but still managable the beach was just destroyed by the wave days before nobody was there besides 2 locals who managed the small store there and they were cleaning up the beach the beach was so dirty so many trash was there when i visited june 27th 2022 its a small beach but because it was so quiet it feels so cozy there is a small stream that flows to the beach i guess thats why they called it pancuran beach i believe it might be way more beautiful before it was hit by huge waves anyways i saw a biawak there
Pancuran Beach,2,i wanted to give it one star but i have some hope that it will be returned to its original glory the beach is strewn with trash and looks like its been abandoned it has so much potential with better management
Pancuran Beach,5,koordinat sunrise karimun jawa
Pancuran Beach,3,certainly not one of the most beautiful beach in karimunjawa full of boats and mosquitoes
Pancuran Beach,5,pasir putih dengan view sunrise sungguh indah di sarankan untuk kesini pagi karena masih sepi belum banyak orang yang datang tapi ada penjaganya meskipun tempat pembelian tiket masih tutup disini juga biasa diadakan pesta pantai kalau malem namun sayang agak kotor karena habis diadakan acara malemnya
Pancuran Beach,3,tempat yg baik utk sunrise
Pancuran Beach,4,pantai ini di sebelah timur pulau karimunjawa enak di pagi hari untuk panorama sunrise
Pancuran Beach,2,juorok bgt pantainyaaaaa
Pancuran Beach,2,beach is good with the hill view but still not well maintain and dirty around the area the road to reach is only by walk or motor bike
Pancuran Beach,5,tempat bagus untuk acara grup sayang akses masuk susah kedepan mungkin bisa dibenahi untuk aksesnya agar lebih bisa mendatangkan lebih banyak pengunjung
Pancuran Beach,4,sunrise area
Pancuran Beach,5,keren banget bbrp minggu kemarin buat acara mice di sinidan view nya jg langsung laut
Pancuran Beach,4,memiliki pemandangan yang indah
Sunset Beach,4,saat belum masuk masa sunset panorama tetep bagus konon katanya pemandu kami sunset terbaik se asia tenggara
Sunset Beach,5,kesini bersama tim visit karimunjawa
Sunset Beach,4,nice beach with lots of restaurants prices elevated coconut 45k lots of touristswater quite deep quickly i would rather recommend alano beach
Sunset Beach,5,bagus sekali
Sunset Beach,5,good view
Sunset Beach,5,pantai terindah yg pernah saya kunjungi pantainya adem karena banyak pohon bersih tak ada sampah biaya masuk cuma 5000 per orang air nya bening bgt ombaknya sedang view nya ajib banyak warung tp dengan harga agak lumayan menurutku ada penyewaan kano dan jetski juga kalo mau sewa makin sore makin ajib sih pemandangannya
Sunset Beach,5,as the name suggests this spot is a mustvisit for sunset lovers picture this a stunning white sandy beach with shallow waters and calm waves perfect for a leisurely stroll along the shore the view is absolutely breathtaking as you watch the sun slowly dip below the horizon painting the sky with vibrant shades of orange and red its a magical moment that will leave you in awe
Sunset Beach,5,sangat mempesona
Sunset Beach,5,pasir putih nyaman untuk bermain anakanak
Sunset Beach,5,a great beach and a breathtaking sunset water is crystal clear just be wary of the biting fish near the corals some small fish are territorial and dont hesitate to bite doesnt hurt feels like a pinch but it will suprise you
Pantai Ambar,5,una playa tranquila y preciosa
Pantai Ambar,5,pantainya bersih bapak ibunya yang punya rumah ramah bisa ngecamp izin dulu dengan bapak ibunya ada fasilitas kursi bersantai gazebo toilet musholaada resto untuk pesan makan dan minumada penginapan juga bagus dan bersih
Pantai Ambar,2,ruhiger strand leider hat es viele schwerlklumpen am ganzen strand
Pantai Ambar,5,sangat tenang dan nyaman untuk bersantai
Pantai Ambar,4,pantai bersih dgn ombak yg kecilcocok untk bersantai
Pancuran Beach,4,tenang senyap
Pancuran Beach,5,loved it
Pancuran Beach,5,enak untuk berkunjung di pagi untuk sunrise
Pancuran Beach,2,they try to clean only 5 meters of the sand and throw all the rubbish just at the edge of the forrest very undermanaged education and public rubbish collection are badly needed they are asking even under these terrible conditions for 10000 cleaning fee otherwise you can buy there some beer for 60000 the place is great for a sunrice watching but just after 5h30 a lady will come to take your 10000 rupiahs
Pancuran Beach,5,didnt eat or drink just had this beach to myself for 2 days so far maybe gets busy on weekends walked from town paid 10000 rp which seems the norm on karimunjawa cannot complain good spot to read my book and chill
Pancuran Beach,4,we were there in the afternoon beautiful beach and seashore scenery clean beach a nice photo shoot spotit is not too wide area but there were only 4 of us and another couple before us feels like private beach theres an entry fee of rp5000pax which the local community charge for maintaining and cleaning the area which was worth the moneyno food stall nor restaurant there
Pancuran Beach,4,bersih pantainya layak untuk di kunjungi
Pancuran Beach,5,viewnya bagus
Pancuran Beach,1,spiaggia a pagamento 10000 rupie a persona credevo che i soldi dati da noi turisti occidentali servissero a mantenere il luogo in cui vivono e tutti noi viviamo pulitoquello che invece mi sono ritrovata dinnanzi dietro al velo di perfezione paradisiaca di un mare cristallino dietro alle sdraio agli ombrelloni e bar stato un mare di plastica seppellito sotto alla spiaggia a giusto 2 metri di distanza da quella attrezzatabottiglie di plastica zaini di plastica ciabatte di gomma sacchetti di plastica nascosti sotto la sabbia candidaquesto stato lo scenario visto e rivisto in differenti luoghi dellindonesia facciata di perfezione che nasconde assenza di rispetto per il loro paese meraviglioso e per tutti noi che viviamo in questo pianetarifiuti gettati per le strade per i boschinon oro tutto quel che luccica molto spesso non altro che plastica
Pancuran Beach,5,nice place beautiful scenery
Pancuran Beach,5,nice secluded beach
Pancuran Beach,5,pantai tersemvuny8
Pantai Bobby,5,selalu rame kalau mau dapet foto bagus harus fateng lebih awal dri yg lain trip lain
Pantai Bobby,5,disini pantai nya baguss banget bersih
Pantai Bobby,3,peccato per la plastica e nonostante sia ancora una delle meglio tenute ne pienaio ho visto solo turisti australiani eo europei a pulire io compresa dicono che la piccola tassa che si paga per entrare nelle spiagge a karimunjawa aiutano i locali a tenere pulite le spiaggemah
Pantai Bobby,5,pantainya bagus banget bersih dan pasir putihnya lembut ombak tenanglandkap nya baguus deh harga tiket masuk idr 10000
Pantai Bobby,4,ein schner strand jedoch wie bei fast allen gepflegten strnden auf karimunjawa muss man hier 10k idr eintritt bezahlen es gibt ein wc gebetsraum bzw eher ein gazebo sitzmglichkeiten einen warung der essen u d trinken verkauft und ca 7 schaukeln die gratis sind und teilweise hoch oben an palmen befestigt sind tagsber kann es relativ voll werden und die meisten wollen fotos von sich mit den schaukeln und anderen spots machenweiter drauen gibt es ein paar schne pltze zum schnorcheln und wenn man motiviert ist knnte man auch zu der kleinen vorgelagerten insel schwimmenvermutlich auch ein guter strand fr den sonnenaufgang hab ich aber nicht getestet und abends wenn das wasser seichter wird knnte man auch zum pantai karina rbergehenda ich fters rezensionen gelesen habe dass man ein boot zur schildkrtenaufzuchtstation mieten kann ich habe ehrlich gesagt nichts positives ber diesen ort gehrt eher im gegenteil und dass es nicht um tierschutz sondern eher tourismus und geld geht und wenn man gegen bezahlung schildkrten freilassen kann ich denke das sagt ja wohl alles
Pantai Bobby,5,terkenal karena ayunan ayunannya pantai pasir putih dan laut yang jernih
Pantai Bobby,5,cantikkk bgtt dan semua spot foto disini free hihihi klo ke karimun wajib bgt ke siniii
Pantai Bobby,5,nous avons pass la soire danniversaire de ma fille lbas ctait super on nous a prpar un feu nous tions seul nous avons pu faire un feu dartifice que nous avions achet dans le centre ville le grant de la plage tait trs prvenant et nous a laiss la musique ma fille tait ravie
Pantai Bobby,5,beautiful view
Pantai Bobby,3,toilet tidak ada air dan banyak sampah
Pantai Bobby,5,belum dapat sunset
Pantai Bobby,5,traumhafter strand bei ostwindwetter etwas aufgewhltes meer
Pantai Bobby,5,pantai bersih rapiindah
Pantai Bobby,5,cantikkk sunrise besttt bgttt kalo dari sinii
Pantai Bobby,5,playa muy bonita con unas preciosas vistas a la ensenada y a las montaas hay que llegar en moto y la carretera es un poco revirada
Pantai Tanjung Gelam,5,jet sky ada kano ada warung ada drone ada
Pantai Tanjung Gelam,5,very nice to see the sunset and many activitys here
Pantai Tanjung Gelam,5,turn the sound on see what i show you about this placeyou will never find a place like this
Pantai Tanjung Gelam,5,a great place to enjoy the sunset
Pantai Tanjung Gelam,5,bagus bgt
Pantai Tanjung Gelam,5,pretty cakep bgt bgt please klo kesini sambil nikmati sunset dan beli kelapa sih best bgt main air dan foto jugaaaa loveeee
Pantai Tanjung Gelam,5,terkenal sebagai pantai untuk menikmati sunset tapi ternyata datang ke sini pagi oke juga kokpasirnya halus airnya sangat bisa untuk main basahbasahan tanpa takut riak terlalu besarminusnya ada banyak semut merah mungkin karena banyak pohon buah yamalah lebih nyaman datang pagisiang karena belum terlalu ramai
Pantai Tanjung Gelam,5,best sunset di pulau karimun
Pantai Tanjung Gelam,5,
Pantai Tanjung Gelam,5,ke sini pas lagi pasang cocok buat canoeing mungkin next bakal coba jetskinya mending dateng jam 4 sorean supaya bisa coba banyak water sport
Pantai Tanjung Gelam,5,ada spot ikonik pohon kelapa miringnya yang paling rame buat foto foto salah satu pantai yang paling oke buat cari sunset banyak persewaan kano dan jetski
Pantai Tanjung Gelam,5,sayang dulu tidak mengabadikan fotovideo dulu 2016 masih asri apakah sekarang masih asri
Pantai Tanjung Gelam,5,destinasi wajib karimunjawa belum ke karimun kalau tidak kesini sunset nya wow banget
Pantai Tanjung Gelam,4,lumayan banget cuman pantainya agak kotor hehe dan kebetulan waktu kesini udah sore pas pulangnya jalannya gelap pol nggak ada lamputapi overall oke
Pantai Tanjung Gelam,5,wajib dikunjungi pas sunset bagus banget
Pantai Tanjung Gelam,5,pantai berpasir putih yang cocok untuk menikmati sunset tersedia bermacam watersport disini dengan segala macam pake dokumentasinya
Pantai Tanjung Gelam,5,pantainya nyaman untuk dikunjungi rekomen buat yang butuh ketenangan perjalanan ke pantai ini ga sia2 lah
Pantai Tanjung Gelam,5,fav untuk spot sunset kalo lagi di karimunjawa
Pantai Tanjung Gelam,5,pantai tanjung gelam partainya bagus bersih ombak nya tenang ada persewaan jetsky kano dan ada dokumentasi dari droneada jual makanan ringan kelapa muda dllbanyak spot foto bagus pantai dengan rumput laut ayunan berbagai titik pohon kelapa miring
Pantai Tanjung Gelam,4,beach in western part of karimun jawa island have beautiful sunset view acces road to tanjung gelam quite narrow makes it difficult if two cars pass side by side price of food in tanjung gelam is quite expensive i bought 1 fresh coconut for 25k
Pantai Tanjung Gelam,5,scenic view nya pohon kelapa miring
Pantai Tanjung Gelam,5,pantai pasir putih yg indah sambil melihat sunset amazing banget woy
Pantai Tanjung Gelam,5,nah paling suka kita ke pantai ini mpe 2x ksini karena bisa main banana boat akses kesini lebih nyaman ya ketimbang ke pantai sunset lebih jauh tapi lebih amannnnnndisini banyak aktifitas ya jetskidronebanana boat kano rolling donut dll si bocil juga suka ngumpulin uang mermaid kata diabanyak warung so far yg kita datangin standar karimun ya kelapa 25rb gorengan 3rb tapi better tanya dulu biar amannah yg ga enaknya tuh toilettttttttttsebisa mungkin kl ga kepepet ga usah ke toilet deh bayar tapi gitu deh ga layak pake banget kl sekedar ganti baju bawa kain penutup aja lah
Pantai Tanjung Gelam,5,hands down the best beach di karimun sore day 1 aku kesana buat foto prewednya temenku dan hasilnya oke banget abis itu day 2 waktu abis snorkling nyantai disitu sambil snorkling lg tipis d tepi pantai ikannya banyak dan so pretty gak nyesel sama sekaliii definitely woll come back
Pantai Tanjung Gelam,3,baru kali ini datang ke pantai tanjung gelaim nuansa alam nya indah bagi saya pulau bali tiada duanya ngak pernah bosan jika berkunjung ke pulau dewata
Pantai Tanjung Gelam,5,sangat wellsayang g bawa pakaian ganti
Pantai Tanjung Gelam,4,this beach is actually connected to sunset beach and you can easily reach it by walking along the shore from there however if you enter from tanjung gelam beach there is an entrance fee of 5000 idr im not sure whether this is an official fee or an informal charge the iconic feature of this beach is probably the leaning coconut tree which tilts at nearly a 45degree angle
Pantai Tanjung Gelam,5,salah satu spot foto pantai terbaik yang ada di karimunjawa bila datang saat sore hari dengan cuaca yang tidak mendung maka akan mendapatkan pemandangan sunset yang sangat indah sehingga disarankan ke sana saat musim kemarautapi saya tidak tahu apakah bila datang ke sana saat musim kemarau akan menjadikan pantai ini sangat ramai atau tidak
Pantai Bobby,5,indah banget pantainya bisa puas fotofofo pokoknya
Pantai Bobby,5,pantainya cantik cocok untuk berenanga bersama anak2 pasirnya putih dan airnya jernih
Pantai Bobby,5,bagus bgt pemandangannya
Pantai Bobby,4,indah sekali pemandangannya
Pantai Bobby,5,magical beach sih inii agak jauh dari kota tapi sangat worth to come akan kembali lg kesini nanti kalo kesini lagi pantainya bersih dan pemandangan bukit sekitar sangat memanjakan mata
Pantai Bobby,5,salah satu spot pantai dengan ayunan estetik
Pantai Bobby,5,anakku paling suka kesini maen ayunan
Pantai Bobby,5,alhamdulillah
Pantai Bobby,1,bayar 10rb tapi sesimpel toilet aja ga ada airnya dan kotor bangetdi karimun masih banyak pantai yang lebih cakep dengan fasilitas umum yang proper
Pantai Bobby,5,view nya keren eksotis dan bersih cocok untuk yang mencari suasana tenang jauh dari keramaian
Pantai Bobby,5,rinduuu pingin baliiikkk
Pantai Legon Lele,5,pantai nya cocok buat menyendiri
Pantai Legon Lele,5,
Pantai Legon Lele,1,harga tiket masuk skrang brpa ya
Pantai Legon Lele,5,tempat yg menjadi basecamp selama 3bulan di karimunjawa
Pantai Legon Lele,5,pantainya agak tersembunyi si inii tapii ga kalahh cakepp pemandangannya sepii jugaa emang karimunjawa salah satu surga indonesia
Pantai Legon Lele,3,after visiting bobby beach i stopped by legon lele and was struck by how quiet it wasalmost eerily so especially when alone the sunrise here is also hard to catch as its blocked by a hill one of the beachs main features is a sunken ship but the beach itself isnt very clean due to its baylike shape where trash tends to collect and its not cleaned frequently the road to the beach is accessible by motorbike though cars may have a bit of trouble navigating it additionally theres a hill in the area and the local sources of clean water comes from this very hill
Pantai Legon Lele,5,sebetulnya pantai yang cukup bagus namun kotor karena banyak sampah yang terbawa oleh ombak
Pantai Legon Lele,3,a deserted beach with shipwrecks you cant swim here the water is very polluted from these ships but its fun to explore this place and take lots of photos with graffiti
Pantai Legon Lele,5,sejuk dan masih asri
Pantai Legon Lele,2,so polluted
Pantai Legon Lele,3,tidak cocok untuk main air dan berenang kotor banyak ranting
Pantai Legon Lele,5,pesisir bersebelahan pantai boby masih fresh ada muara hutan bakau waspada serangan nyamuk disini
Pantai Legon Lele,5,pantai legon lele pantai di ujung pulau karimun pantainya bersih dan kereen pemandangannya
Pantai Legon Lele,4,bisa dibilang tetangga nya pantai bobby jaraknya sekitar 5 menitan lebih dikit jalan kaki dari pantai bobby jalannya kecil tapi masih bisa banget diakses pake motor mobil juga bisa tapi mungkin ga yang lebar lebar banget mobil pick up yang standar bisa terus pantai legon lele ini juga fokusnya ke pariwisata mangrove kebetulan aku kemaren emang juga lagi penelitian tentang itu jadinya mampir cuman agak kurangnya pantai ini sepi pengunjung dan emang agak serem kalo terlalu malem kesini nya soalnya kayak gaada penerangan jalannya tapi buat foto foto gitu cocok kok tapi itu tadi aku saranin datengnya siang aja yah
Pantai Legon Lele,5,salah satu hidden gem ini mah di karimunjawa kalau kalian tau nunggalan beach di bali ini seperti itulah ada kapal terbengkalainya yang dimuralin viewnya indah deket dengan hutan bakau dan masih deket dijangkau dari pantai bobby kalau pas gak musim angin barat ini tempat bersih dan rekomended sih free biaya masuknya
Pantai Legon Lele,4,hidden paradise1 pantai yg campervan bisa turun dan side byside dengan tendabelum dikelolaombaknya tenang karna ada di telukdasar pasirnya padatkeras jadi aman di lalui 4x4 stdbanyak sampah mengendap di dasar harus lebih diperhatikan dan ada endapan dari hutan mangrove jadi air seperti terlihat kotor
Pantai Legon Lele,5,bisa jadi pantai ini kotor yaa kotor dan tumpukan sampah di sepanjang garis pantai jalanannya agak becek belum terbangun sempurna seakan pantai yang ditinggal dan tidak dirawat namun kalau diamati benar2 pantai ini cantik loh kontras dengan saudaranya si pantai bobby yang berair hijau tosca yang ramai dikunjungi pengunjung pantai si legon lele terlihat menarik dengan caranya sendiri warna kekuningan yah kekuningan kaya air kencing namun jangan salah itu adalah air dari pohon bakau jika diperhatikan warna kuning keemasan nya itu unik waktu kesini dan berjalan mengexplore pesisirnya yang disuguhkan kepada kami adalah warna air kuning keemasannya kami tidak terlalu peduli dengan saking banyaknya sampah yang berserakan namun yang kami tangkap adalah si cantik legon lele menyambut kami dengan wujud dirinya sendiri beda apa adanyadi seberang pantai nampak bangunan semacam rumah terapung yang mengingatkan kami kepada ora beach di maluku semoga kedepannya pantai cantik ini ada yang peduli peduli pada warna dirinya yang beda peduli pada kuning keemasan warna air nya kuning keemasan kejayaan semoga sampah2 jadi hilang dari pantai secantik ini
Pantai Legon Lele,3,mampir sebentar pasca dari pantai boby di karimunjawa niat hati mau sunrise disini tp pikirnya krn agak sepi dan ternyata sepi beneran agak creepy kalo pas sendiri sunrise dr sini jg tdk terlalu kelihatan krn ketutup bukitikon di pantai legon lele adalah kapal yg karam jd ya itu sj ikonnya menurut sy pantai memang tdk terlalu bersih karena bentuknya teluk dan sampah biasanya berkumpul di teluk apalagi tdk sering dibersihkan jalan masih bs diakses dgn motor mobil agak ngepres tp kmrn ketemu penduduk lokal yg bawa mobil dr arah legon lele jg sihdi legon lele ada bukit dapet cerita dr karyawan hostel kalau salah satu sumber air bersih dari bukit di legon lele itu
Pantai Legon Lele,5,gak ada apa apaa
Pantai Legon Lele,4,hope that i write this right because i was scrolling around without maps i found this place just couple blocks from bobby beach i didnt mind with how mother nature works i was born and grown up living nearby the oceans someday the seashore is clean and another day would be some rubbishes climate change pandemic as well can be understood tho if the local do take care of course its voluntary kinda stuff see ya in another bright occasion
