title,stars,text
Pantai Batu Lawang,5,dermaga di batu lawang tergolong sebagai dermaga yang cukup besar dan bagus sehingga kapal besar pun bisa merapat ke dermaga ini warna biru selalu berada di sekeliling kita dimanamana biru subhanallah waktu itu kita sudah terlalu lapar jadi kita makan roti tawar yang kita bawa sebagai pengganjal perutbinokuler juga bisa berfungsi untuk melihat pulau diseberang sana langsung aja dengan perbesaran lensa yang agak lumayan namun terbatas juga pandangan penglihatan dengan menggunakan alat tersebut kita amati pulaupulau tersebut pulaupulau yang terlihat kecilkecil pasti di tempat itu menyimpan beribu keindahan indah nian tempat ini subhanallah
Pantai Batu Lawang,5,pantai batu lawang
Pantai Batu Lawang,4,pantai batu lawang memiliki akses yang cukup baik khusus untuk motor pantai di lokasi ini cukup tenang tidak ada biaya restribusi ketika masuk
Pantai Batu Lawang,5,alami nan asri
Pantai Kanjen,5,cocok bakar ikan
Pantai Kanjen,4,menarik selalu ngangenin
Pantai Kanjen,5,pantai kanjen ini mempunyai pasir putih lembut dan air nya hangat dan ada konservasi penyu
Pantai Kanjen,4,salah satu tujuan wisata bahari di karimunjawa di sini ada konservasi penyu cocok memang pasir pantai nya lembut dan air nya hangat
Pantai Kanjen,5,wonderful natural view
Pantai Kanjen,5,pantai kanjen
Pantai Kanjen,5,pantainya bersih dan jernih dengan tambahan penangkaran penyuakses perlu naik boat dan tidak banyak orang tau bagaimana menuju lokasi initanyalah pada penduduk sekitar pantai legon lele atau pantai bobi cara menuju ketempat iniserasa pantai milik sendiri
Pantai Kanjen,5,petugasnya ramah tempatnya bersih bakal banyak belajar di tempat ini
Pantai Kanjen,5,must visit this place its has sea turtle conservation site you can realease baby turtle to the wild here i recommend to visit at sunset time the ligth combined with the beach and forest just magnificent
Pantai Kanjen,5,pokoknya keren
Pantai Batu Lawang,5,pantai masih sangat alami jarang ada turis datang recomended untuk orang yg ingin menikmati pantai dengan tenang
Pantai Batu Lawang,5,keren2 pantai di karimun
Pantai Batu Lawang,5,pingin banget kesiniiii
Pantai Batu Lawang,5,perfek
Pantai Batu Lawang,4,jolie plagepetit bar pour se rafraichir ou prendre un snack
Pantai Batu Lawang,5,pelabuhan nelayan yang harus nyebur kalo naik perahu
Pantai Batu Lawang,3,compare to the other area in karimun jawa i can only give 3 start for this beach
Pantai Batu Lawang,5,pantenya bersih dn lautnya jernih serta pemandangan yg sangat sangat natural
Pantai Batu Lawang,5,
Pantai Batu Lawang,3,tempat yg msh alami msh ada tradisi dan adat
Pantai Batu Lawang,4,sunset nya indah sekalo
Pantai Batu Lawang,3,quite a small beach and nothing much to sea
Pantai Batu Lawang,5,so beautifull
Pantai Batu Lawang,4,terdapat penginapan khas suku bugis disini rumah panggung begitu tapi jalan menuju pantai ini masih jalan setapak
Pantai Kanjen,5,vi visit this kanjen beach for releasing baby turtles we took a small boat off from lele beach and the journey took about 10 15 minutes the view was great the water is crystal blue clean area and not so many visitors a quite place where you can just relaxing and enjoy the view of the beautiful sea and land
Pantai Kanjen,5,tujuan wisata
Pantai Kanjen,5,kawasan ini adalah zona inti taman nasional karimunjawa yang dijadikan sebagai obyek wisata terbatas di lokasi ini terdapat perlindungan untuk telurtelur penyu di ruangan khusus untuk menghindari predator dan jika beruntung wisatawan dapat melepasliarkan tukik ke laut bersama penjagapantai ini menjadi salah satu pilihan untuk penyu mendarat karena pasir yang halus dan hangat serta minim predator karena daya dukung lingkungan yang rendah akibat sistem das yang sangat sempit bagi wisatawan pasir halus ini dapat dibuat istana pasir d
Pantai Batu Putih,5,taking nap under the trees is super relaxing
Pantai Batu Putih,4,bisa buat menyepi
Pantai Batu Putih,4,pasir putihnya menakjubkan
Pantai Batu Putih,4,pasir putihpantai nya tidak cukup luaspemandangannya bagusjangan kesini pas musim angin timur mulai bulan juni sampai september karena gelombang akan tinggiair pasang di siang hari
Pantai Batu Putih,5,di karimun jawa yang no 1 ya ini
Pantai Batu Putih,5,quiet place for relaxing beach
Pantai Batu Putih,2,dont waste gasolinetime going here
Pantai Batu Putih,5,tempt sejak kecil untuk melepas lelah menihat sunrise mancing dan berenang
Pantai Batu Putih,5,the turnoff to the beach is small so be on the lookouttake anti mosquito cream as you will be attacked by them when you stopit is a short walk down to the beach you will pay 5 000 idr for parkingthe beach has beautiful white sand and there are many places to snorkelthere are many places for you to take photos so dont forget your camera
Pantai Batu Putih,5,lovely
Pantai Batu Putih,5,pantai ini sgt cocok buat snorkling santai dan barmain air laut dgn pasir putih yg sgt bgs dgn pemandangan yg sgt romantis
Pantai Batu Putih,5,pantai yang masih sepi bebas memandang laut biru bisa untuk berenang
Pantai Batu Lawang,5,pantai ini adalah dermaga kecil perahu nelayan suku bugis dari bibir pantai anda coba mendayung ke arah lautan kemudian sekitar 50 meter setelah melewati karang gosong ada spot snorkeling yang menarik meskipun sebelum itu sampai anda akan ketemu dengan kawasan terumbu karang yang rusak karena kawasan ini masuk ke dalam zona rehabilitasi dengan menyewa perahu jukung dari nelayan kita bisa menemukan spot snorkeling yg menarik
Pantai Batu Lawang,1,kalo menurut saya tempat ini kurang worth it
Pantai Batu Lawang,5,love this place
Pantai Batu Lawang,5,cocok untuk sunburn
Pantai Batu Lawang,2,petunjuk jalan kok ndak jelas ya kalau mau kesini dipahami dulu rutenya soalnya penunjuk jalan nya minim warga
Pantai Batu Lawang,5,sebuah pantai yang indah dikelilingi tebing batuan yang terangkat karena proses geologis gradasi antara hutan mangrove pandan dan hutan hujan tropis dan padang ilalang yang sangat indah jalur pantainya jika akan menyusuri masih sangat sulit akan tetapi sangatlah indah
Pantai Batu Lawang,4,cenderung sepi dan bukan spot untuk snorkling
Pantai Batu Lawang,4,eksotik
Pantai Alano,5,pantai ini tenang suka kesini kalau pengen nga ngapangapain
Pantai Alano,5,masuk ke pantai hanya bayar 5000 anak kecil gratis pantainya nyaman buat tiduran enjoy the day
Pantai Alano,5,saya datang pagi set 6 karena berharap bs dpt sunrise dan benar indah sekali
Pantai Alano,5,pantai yang belum begitu ramai pengunjung waktu saya kesana hanya sedikit pengunjung lebih enak dan private tempatnya memang agak jauh dari pusat kota dan jalanan tidak begitu mulus tapi pas sampai di pantainya wow sekali super sekali pemandangannya bersih pasirnya putih
Pantai Alano,4,prachtig zand strand met een hoop schommels ze hebben wel bedjes maar die zijn van hout na 10 min liggen doet je hele lijf pijnop de meeste stranden hebben ze geen ligbedjes kunnen ze hier niet erg jammer
Pantai Alano,5,pantai alano adalah pantai pertama yang aku kunjungi disaat dateng parkir motor di atas lalu jalan kaki ke bawah sepanjang jalan mau ke pantai aja udah amazing masyaallah indah banget pantainya lumayan sepi aku dateng hari jumat
Pantai Alano,5,pantai nya bersih dan kalo pagi masih agak sepi jadi kayak private beach kita gak perlu sewa tempat duduk masuknya bayar 5000 kayak nya lupa
Pantai Alano,5,bellissima spiaggia tranquilla un paradisoa disposizione sdraio di legno e ombra delle piante
Pantai Alano,5,hidden beach di karjaw menepi sejenak dari keramaian karjaw di kala high season pantai nya sepiii cocok buat orang introvet yg pengen nikmatin pantai tapi ga crowded jarak dari pusat karjaw 25 menit tapi worthed banget buat bengang bengong
Pantai Alano,5,rustig en mooi strand
Pantai Alano,4,beautiful and quite beach which is the main argument for visiting since for swimming and snorkeling there are better options
Pantai Alano,5,cobran 10000rp por persona es una playa muy agradable y tranquila con poca gente tumbonas de madera hamacasagradec que no tuvieran msica hay un pequeo warung donde venden aguarefrescos y noodles el agua cristalina y la plata muy limpia
Pantai Alano,5,berasa kek private beach disana pagi
Pantai Alano,5,one of the most beautiful beaches on the main island a quiet palmlined beach with no trash tip be quick for a cool bintang beer
Pantai Alano,5,harga masuk ke pantai 5k sangat sangat worth it untuk pantai yg bersih tenang dan tidak banyak orang
Pantai Alano,5,paradise
Pantai Alano,5,pantai nya cukup terpencil dan jauh dari pusat kota tp pasir nya putih dan cukup jernih air pantai nya kemudian ada sarana buat ganti dan toilet jg warungrekomen buat yg mencari pantai yg tidak terlalu ramai dan butuh ketenangan
Pantai Alano,5,beautiful beach and well kept clean and lovely ambiance please keep it in this way
Pantai Alano,5,pantai yg sepi dan bersih
Pantai Alano,5,the best beach in karimunjawa the best place for camping the family who runs the business and takes care of the area is very nice
Pantai Alano,2,unfortunately the shoreline was full of plastic rubbish where we set up the middle part of the beach looked cleaner i dont mind paying an entry fee when the beach is maintained but this was too grotty for me its a shame because if clean it would be idyllic we didnt stay long and wont be back
Pantai Alano,5,masih sepi banget akses jalan agak susah better naik motor aja tiket masuk 5rb dan banyak view kapal must go bener bener bisa santai disana hidden gem banyakan bule drpd lokal disana even weekend
Pantai Alano,5,spiaggia idilliaca a nord est dellisola raggiungibile facilmente con il motorinole sole 5000 rupie di biglietto giornaliere valgano uno spettacolo naturale assicuratosdraio di legno e posti per rilassarsi sono gi presenti nella struttura il personale molto cordiale e c la possibilit di ordinare bevande o cibo cucinato sul momento
Pantai Alano,5,fantastica
Pantai Alano,5,a hidden calm and beautiful beach di saat datang di karimun di tanggal long weekend dengan semua penginapan penuh ternyata justru alano sangat sepi benarbenar cuman bule yang tau a virgin beach pasir putih bersih air tenang dan biru mudajika ke karimun wajib ke pantai ini karena benar2 belum banyak yang tau perjalanan memang cukup jauh 30 menit drai pusat kota tapi percayalah begitu parkir motor matamu akan terpuaskan dengan pemandangannya
Pantai Alano,5,kinda chill and good for sunbathing here however its cloudy and rainy when i visited this place ticket is 5kperson open from 7304pm only you need to walk down to the beach from the parking area recommend visiting anora beach as well while visiting this area
Pantai Alano,5,bagus masih tidak terlalu ramai
Pantai Alano,5,tempatnya enak buat rebahan ada siputih tp nggak galak cuma nggonggong aja klo udah dikasih makan dia nggak nggonggong
Pantai Alano,5,very very very nice beach5000 rupees entry fee is well worth ithas a spot with lots of clown fishes
Pantai Alano,5,super schner strand sehr sauber und ruhig die betreiber des kleinen lokals sind sehr freundlich und das essen schmeckt super
Pantai Alano,5,masih asri sepi pengelolaan seadanya namun justru menjadi daya tarik sendiri lebib suka disini karna sepi
Pantai Alano,1,dont come herekulit kami mengalami gatal2 akibat masuk ke air pantai alano ternyata airnya tercemar tambak udang dan parahnya tidak diberi tahu oleh penjaga pantai plus untuk masuk harus bayarmohon ditindak lanjuti karena sangat berbahaya bagi kesehatan wisatawan
Pantai Alano,5,sangat rekomendasi banget ketika berkunjung atau berwisata ke karimunjawa pasirnya putih bersih air lautnya jernih dan masih asri dan tidak banyak tamu cocok buat destinasi untuk merilekskan pikiran
Pantai Alano,5,pantainya cantik dan gak terlalu ramai sekitar 25 menit dari dermagamasuk bayar 5000 ada warung dan toiletkesini menghibur diri
Pantai Alano,5,trs belle plage bien entretenue top pour faire de la baignade farniente snorkelingparking mototres bon moment y passer
Pantai Alano,5,einfach nur traumhaft da kommt man nach einer fahrt durch dieses unscheinbare wohngebiet pltzlich an diesem strand raus auch ganz gut zum schnorcheln allerdings muss man ewig weit gehen das wasser ist sehr flach
Pantai Alano,5,spiaggia paradisiaca disponibili lettini tavoli e sedie in legno ci sono tante altalene anche nellacqua c anche un piccolo punto di ristoro dove rinfrescarsi con una bella noce di cocco ingresso di 5k
Pantai Alano,5,keren
Pantai Alano,5,la mejor y mucho mejor que su vecina annora es una muy buena playa que dependiendo de la marea cambia tiene servicios bar comidas mesas hamacas columpios lavabo pero lo mejor de todo son los peces payaso nemo no es necesario contratar una excursin de snorkel para verlos los tenis prximos a la playa y marcados con postes con la senyal nemo spot
Pantai Alano,5,tempatnya bagus bersih terawat tiket masuknya murah dan cukup sepi cocok buat lihat sunrise kalo ke sana jaga kebersihan ya temanteman
Pantai Alano,5,5k entrance with one shack and a toilet the beach itself is clean the surroundings pretty full of trash clean calm transparent waterbetter to come in the morning or mid day first thing better light and sunshine
Pantai Alano,5,pantainya sepiiii banget anginya sepoy sepoy warga lokal juga ramah bngetttt sayng aksesnya masuk masuk hutan recomend yg sedang mencri ketenangan ombaknya agak besar masuknya 5000 org
Pantai Alano,4,5k entrence fee normal amount for most kept beaches in karimunjawa beautiful area lots and lots of swings
Pantai Alano,5,luar biasa pantai terindah yang pernah saya kunjungi pasir dan air bersih sekali ada ayunan di manamanapengelola baik dan ramah ada wc dan suasanya tenang
Pantai Alano,5,sehr ruhig und abgelegen sehr schn eintritt aktuell 10000 pro person wahrscheinlich gilt dieser preis fr auslnderbei flut ist ein groteil des strandes vom wasser berspltwir konnten keine kokosnsse kaufen
Pantai Alano,5,ini pantai bener2 indah banget tersembunyi ga banyak yang datang bersih banget klo naik mobil jalanya sempit better naik motor kalo kemari parkir di atas kemudian jalan turun ke pantainya sumpah indah dan beraih banget
Pantai Alano,5,tenang dan damai pas sepi kesana
Pantai Alano,5,recommend for sunrise
Pantai Alano,4,posto carino x prendere il sole il bel mare 1 altra cosa
Pantai Alano,4,sepi cantik tp agak kurang nyaman sama sampah dari pohon2nya yg jatuh ke pantai
Pantai Alano,3,la plage est sympa mais sale rien voir dans leau beaucoup de bateaux de pche et de casiers sur place
Pantai Alano,5,
Pantai Alano,5,cool place and litterly no one there so you got the place for yourself
Pantai Alano,5,indah bgtt bersih
Pantai Alano,5,i visited this beach on sunday around 10 am and it initially had 2 visitors and theyre all foreigners its so calm and windy that day no one said a thing for a long time haha its the perfect place to chillax the cleaning fee is rp 5000 no parking fee i bought a coconut for rp 15000
Pantai Alano,5,datang kesana pagi2 saat tempatnya sepi angin sepoi sepoi sambil minum kelapa muda terbaik
Pantai Alano,5,compared to anora beach alano beach is clean alano beach is recommended for rest fee 5k use to cleaning beach
Pantai Alano,5,la playa mas bonita de karimunjawa queda un poco retirada a una media hora en scooter pero el viaje vale la pena hay que pagar una pequea entrada como en casi todas las playas de la isla tiene bar y hamacas
Pantai Alano,5,nuestra playa favorita de karimunjawa muy tranquila y bonita con sitios para sentarse y tomar algo
Pantai Alano,4,una delle pi carine dell isolaci vuole un per arrivare dal porto ma ne vale la penacercano di tenerla pulita come non succede in altre spiagge
Sunset Beach,5,this was a real experience the beach was clean and you can swim in the beach and great swings white sand and coconut tree and beautiful sunset this is a must
Sunset Beach,5,very nice beach good for swimming and they sell cold beer as well
Sunset Beach,5,aprs avoir visit pratiquement toutes les plages de karimunjawa cest ici le meilleur compromis facile de se baigner profondeur trs vite guinguette avec fauteuils sacs bien agrable ambiance sympa accs relativement facile en scooter
Sunset Beach,4,tempatnya nyaman buat santai buat kalian yang mau jetski disini juga menyediakann sewa jetski kano juga adaaa
Sunset Beach,5,klo pagi pagi jangan di tanya indah banget kalau dateng langsung airnya bersih jernih pemandangannya behh
Sunset Beach,5,menghabiskan waktu untuk sunsetan disini dapet kesempatan foto di pohon kelapa yg jadi icon pantaiselain itu sempat bermain volly bareng warga sekitar seru banget mereka ramah2harga makanan juga bervariasi tidak mahal siapkan uang cash
Sunset Beach,5,jolie petite plage pour le coucher de soleil entre payante 10 000 roupies on peut faire du snorkeling attention au poisson qui mord il y a des warungs pour manger ou boire un verre
Sunset Beach,4,effectivement cest le spot pour un coucher de soleil
Sunset Beach,4,must try
Sunset Beach,5,nice clean beach
Sunset Beach,5,spot foto terbaik menikmati sunset
Sunset Beach,5,cafe dipinggir pantai dikarimunjawa suasana tenang dan adem pelayanan nya oke sekaliditambah ditemenin pacar saya yang ganteng bikin seru obrolan
Sunset Beach,5,bagusss dan sangat indahhhh
Pancuran Beach,3,c tait une belle plage mais maintenant ils ont du travail pour lui redonner son aspect agrable
Pancuran Beach,1,even though this could be a nice location you can certainly skip this beach its dirty and the small kiosk is broken down
Pancuran Beach,1,the baldys
Pancuran Beach,2,eigentlich ein schner strand leider wird er nicht gepflegt und ist voller mll
Pancuran Beach,4,pantai bagus tapi masih dalam perbaikan ada pancuran sesuai namanya
Pancuran Beach,2,unglcklicherweise wird dieser strand nicht mehr gepflegt und der strand sowie das meer sind voller mll
Pancuran Beach,5,yang cedera or pemulihan cedera cocok fisioterapi disini di klinik mitra medika abadi rawabadak
Pancuran Beach,5,sunrise spot reachable by motorcycle only
Pancuran Beach,5,pisang gorengnya enak
Pancuran Beach,5,i was in pancuran beach on 02142025 the beach is beautiful since it is still low season people are doing maintenance to the facilities and cleaningon the beach there is a kiosk where i could eat some good fishon the beach there is a gentleman who can guide you in a really exciting snorkelinghe knows every little detail of the beautiful coral reef and the clownfish seem to recognise himthe clownfish kiss was really excitingif one day i return to karimunjawa this beach will be the first place i go
Pancuran Beach,5,pantainya indah bersih juga
Pancuran Beach,5,the perfect place for an introvert like me
Pancuran Beach,4,riipumatosta plussaa ranta tosi siisti ikv kyll kioski oli tnn kiinni
Pancuran Beach,5,sebetulnya tidak sengaja mampir ke pantai pancuran karena terlambat bangun untuk mencari sunrise di pantai bobby karena tertinggal rombongan akhirnya berhenti dan mampir di pantai pancuran masih dapatlah momen sunrise
Pancuran Beach,5,der strand ist wirklich sehr schn und perfekt zum schnorcheln und um den sonnenaufgang zu gucken der strand wird von jawa sauber gehalten welcher am strand bilder malt und uns eine wunderschne schnorcheltour gegeben hat ich kann diesen strand und einen besuch bei jawa nur empfehlen
Pancuran Beach,5,jawa is an amazing person and gave us a snorkeling tour today at the beach he showed us several spots where to find nemo fishes the experience was amazing i really recommend this beach and jawa if you want a nice experience the beach is clean and calm wonderfull for people who dont want to go to touristic places
Pancuran Beach,5,great beach it is being kept clean by a fantastic guy called jawa he also does snorkelling trips at the beach worth visiting
Sunset Beach,5,so nice
Sunset Beach,5,awesome view to see the sunset
Sunset Beach,5,couch de soleil magnifique
Sunset Beach,5,pantai bersih n bagus
Sunset Beach,5,very pretty beach as well as the adjacent ones leftmost tanjung gelam is more for waterspots and photoshoots sunset beach is for the sunset and eating and batu topeng is a great place for chilling out and swimming as the water is deeper here theres also a volleyball netyou can walk between all three very easily the beaches are super clean and have all the necessary amenitiesin september i found them to be almost empty during the day even on a saturday but they get busier around 3 onwards as sunset approached
Sunset Beach,5,bagooozz
Sunset Beach,5,pantai indah dan bersih salah satu spot terbaik untuk melihat sunset
Sunset Beach,4,pantai sunset beach ini juga salah satu pantai di karimun jawa yang bisa dibilang sebagai salah satu spot foto turis apalagi pohon kelapa miringnya yang antrian fotonya aja panjang banget secara umum bisa dibilang pantai ini juga ramai banget apalagi di jamjam sunset di masa liburanuntuk pantainya sendiri juga cantik banyak karangkarang juga yang bisa dipakai buat duduk bengong atau spot foto alternatif selain itu juga ada banyak cafewarung dan merchant yang sedia penyewaan kanowater sport
Sunset Beach,5,keren banget sumpahsayangnya ketinggalan sunsetnya
Sunset Beach,5,the magic of karimun ajawa
Pantai cemara besar,5,view keren pantai dangkal sampai kapal sulit sandar tapi jadi bisa main agak tengah makan siang dsini dengan ikan kuning bumbu bakar joss mantab ikannya daging tebal sambal enak
Pantai cemara besar,5,pantai yg sangat teramat indah sampai termimpi2 akhirnya kami datangi lagi untuk kedua kalinya dan wow sungguh indah saat air laut surut terlihat pasir timbul yg sangat teramat luas
Pantai cemara besar,5,harus banget kesini lagii
Pantai cemara besar,5,pulau dengan view yang indah pantai pasir putih air jernih tersedia beberapa fasilitas warung toilet mushola
Pantai cemara besar,5,the best beach in karimun island my friend really enjoy and happy
Pantai cemara besar,5,bagus pulau pasir dengan air yg dangkal
Pantai cemara besar,5,wonderfull
Pantai cemara besar,5,best
Pantai cemara besar,5,masya allah betah bgt dsni pasirnya putih lembut airnyaaa buwiruuu bening
Pantai cemara besar,5,betah berlamalama di pulau ini pantai pasir putih yang luas dan ombak yang tenang
Pantai cemara besar,4,bagus
Pantai cemara besar,5,salah satu pulau terbaik
Pancuran Beach,5,salah satu tempat menikmati sunrise di pulau karimunjawa
Pancuran Beach,5,meskipun akses masuk agak terjal dikit tapi bagus juga pantainyasyg dipojok selatan bnyak tumpukan sampah botol2
Pancuran Beach,4,access road to here is quite challenging for motorcycle but the place is nice
Pancuran Beach,4,plage gratuite les grantes nous ont fournies un tapis pour poser nos serviettes il y a beaucoup dalgues nanmoins la plage reste bien entretenue grce un monsieur qui la nettoie joli spot de snorkeling et de lever du soleil
Pancuran Beach,1,cest hyper sale
Pancuran Beach,4,they claimed to be the first beach that has been opened in karimunjawa the coastline is quite narrow its a good beach with white sand and turquoise clear sea water but thats all nothing special compared to other beach
Pancuran Beach,5,sangat nyaman bersih dan tenang
Pancuran Beach,5,the best beach with the best guy jawa who is so so welcoming and lovely a must on this island
Pancuran Beach,4,mungkin ini pantai terdekat dr pelabuhan dgn spot sunrise masuknya gratis ada warungnya juga tapi agak kurang bersih dibandingkan dgn pantai2 lainnya di karimun
Pancuran Beach,5,really great beach hut serving some excellent ayam ikan fresh juice etc reusable metal straws lovely fresh sambals so good we revisited perfect lunch spot cute beach can swim out to snorkel with nemo long tailed macaques
Pancuran Beach,5,plage tranquille les propritaires sont adorable le monsieur a le sourire tout le temps sa femme est une excellente cuisinire
Pancuran Beach,5,kalau ke karimun wajib banget kesini karena pantainya tenang banget aku dateng pas pagi dan cuma ada aku di sana padahal itu hari minggu tapi maaf waktu itu ga beli di kafenya
Pancuran Beach,5,amazing place trs calme personnel trs gentil et accueillant je recommande fortement
Pancuran Beach,5,magnifique plage elle est plus proche de la ville lentre est gratuite il y a du wifi et on y mange trs bien surtout les nouilles sautesnous avons largement prfr celle ci bobby beachnous y sommes alls un samedi aprsmidi et il ny avait pas grand monde le grant de la plage prte gratuitement des matelas et loue des masques et tubas de snorkeling pour 25k il nous a mme accompagn pour nous montrer les meilleurs spots de snorkeling
Pancuran Beach,4,rekomen bgt kesini buat nikmati sunrise ala karimun btw tempatnya enak gampang diakses cuman minusnya kotor sih tp tenang g ngurangi keindahan dan ketenangannya htm free
Pancuran Beach,5,sauber familir gutes essen gute preise
Sunset Beach,5,sebagus itu sunsetnya pasirnya juga putih bersih makanan di warungnya juga terjangkau untuk tempat wisata
Sunset Beach,5,pantai yang landai bersih pasir putih air yang jernih ditambah warung2 untuk bersantai menikmati sunset
Sunset Beach,5,salah satu pantai yang luar biasa di pulau karimunjawa pasir putih bersih dengan air laut yang jernih lebih bagus daripada pantai di bali menurut pendapat saya pribadi
Sunset Beach,5,bisa menikmati sunset jika cuaca cerah
Sunset Beach,5,great musics here and good vibes
Sunset Beach,5,very beautiful clear water good drinks
Sunset Beach,5,no es exactamente sunset beach sino justo el mercadillo que hay a su entrada espectacular nasi goreng lo lleva una chica joven super agradable y simptica hay cervecita ice coffe a pie de playa hamacas qu ms se puede pedir el mejor nasi goreng que he probado hasta ahora gracias
Sunset Beach,4,lokasi nya mantap banget buat menyambut sunset dinsore hari kako mau kesini harus agak lama ya karena nyaman ditempat ini
Sunset Beach,5,perfekt um den sonnenuntergang anzuschauen
Sunset Beach,5,des amnagements plutt ddis au tourisme mais un lieu qui a su prserver la magie dune plage superbe sur karimunjawa
Sunset Beach,4,yaah okey laah okey okey boleh boleh
Sunset Beach,5,best sunset di karimunjawa wajib kejar sunset disini indah banget
